static-build/posts/2026/10/jpeg-xl-vs-avif/images/cat-illustration-targets/targets.json

{
  "input": "/Users/jarchibald/dev/image-codec-bench/inputs/cat-illustration.png",
  "reference": {
    "path": "/Users/jarchibald/dev/image-codec-bench/out/cat-illustration-targets/.tmp/reference.png",
    "width": 1598,
    "height": 2131,
    "depth": 8,
    "channels": 3,
    "hasAlpha": false,
    "megapixels": 3.405338,
    "strippedChunks": [],
    "resized": false,
    "source": {
      "width": 1598,
      "height": 2131,
      "hasAlpha": false
    }
  },
  "versions": {
    "avifenc": "1.4.2",
    "avifdec": "1.4.2",
    "cjxl": "0.12.0",
    "djxl": "0.12.0",
    "ssimulacra2": "4dbb9a9c96d74608",
    "cwebp": "1.6.0",
    "dwebp": "1.6.0",
    "magick": "7.1.2",
    "cjixel": "cjixel: jixel 0.4.2 (git f487299)"
  },
  "results": [
    {
      "codec": "avif",
      "effort": 0,
      "depth": 8,
      "yuv": "444",
      "target": 50,
      "quality": 20,
      "score": 51.48331134,
      "bytes": 27559,
      "file": "avif-q20-e0-d8-yuv444-ssimu51.5.avif"
    },
    {
      "codec": "avif",
      "effort": 0,
      "depth": 8,
      "yuv": "444",
      "target": 60,
      "quality": 28,
      "score": 60.33151842,
      "bytes": 34518,
      "file": "avif-q28-e0-d8-yuv444-ssimu60.3.avif"
    },
    {
      "codec": "avif",
      "effort": 0,
      "depth": 8,
      "yuv": "444",
      "target": 70,
      "quality": 39,
      "score": 71.4548049,
      "bytes": 47287,
      "file": "avif-q39-e0-d8-yuv444-ssimu71.5.avif"
    },
    {
      "codec": "avif",
      "effort": 0,
      "depth": 8,
      "yuv": "444",
      "target": 80,
      "quality": 52,
      "score": 80.18735361,
      "bytes": 68522,
      "file": "avif-q52-e0-d8-yuv444-ssimu80.2.avif"
    },
    {
      "codec": "avif",
      "effort": 0,
      "depth": 8,
      "yuv": "444",
      "target": 90,
      "quality": 99,
      "score": 86.58928993659764,
      "bytes": 309878,
      "file": "avif-q99-e0-d8-yuv444-ssimu86.6.avif"
    },
    {
      "codec": "jxl",
      "effort": 10,
      "depth": 8,
      "yuv": null,
      "target": 50,
      "quality": 18.1,
      "score": 51.0306465,
      "bytes": 56206,
      "file": "jxl-q18.1-e10-ssimu51.0.jxl"
    },
    {
      "codec": "jxl",
      "effort": 10,
      "depth": 8,
      "yuv": null,
      "target": 60,
      "quality": 23.3,
      "score": 60.02541318,
      "bytes": 67189,
      "file": "jxl-q23.3-e10-ssimu60.0.jxl"
    },
    {
      "codec": "jxl",
      "effort": 10,
      "depth": 8,
      "yuv": null,
      "target": 70,
      "quality": 44.9,
      "score": 70.22921367,
      "bytes": 90491,
      "file": "jxl-q44.9-e10-ssimu70.2.jxl"
    },
    {
      "codec": "jxl",
      "effort": 10,
      "depth": 8,
      "yuv": null,
      "target": 80,
      "quality": 72.1,
      "score": 80.01559127,
      "bytes": 139759,
      "file": "jxl-q72.1-e10-ssimu80.0.jxl"
    },
    {
      "codec": "jxl",
      "effort": 10,
      "depth": 8,
      "yuv": null,
      "target": 90,
      "quality": 97.4,
      "score": 90.06964245,
      "bytes": 383648,
      "file": "jxl-q97.4-e10-ssimu90.1.jxl"
    },
    {
      "codec": "jixel",
      "effort": 6,
      "depth": 8,
      "yuv": null,
      "hdrMode": null,
      "patches": false,
      "target": 50,
      "quality": 18,
      "score": 51.34447062,
      "bytes": 33474,
      "file": "jixel-q18-e6-ssimu51.3.jxl"
    },
    {
      "codec": "jixel",
      "effort": 6,
      "depth": 8,
      "yuv": null,
      "hdrMode": null,
      "patches": false,
      "target": 60,
      "quality": 48.4,
      "score": 60.35239216,
      "bytes": 42699,
      "file": "jixel-q48.4-e6-ssimu60.4.jxl"
    },
    {
      "codec": "jixel",
      "effort": 6,
      "depth": 8,
      "yuv": null,
      "hdrMode": null,
      "patches": false,
      "target": 70,
      "quality": 70.9,
      "score": 70.17137397,
      "bytes": 62478,
      "file": "jixel-q70.9-e6-ssimu70.2.jxl"
    },
    {
      "codec": "jixel",
      "effort": 6,
      "depth": 8,
      "yuv": null,
      "hdrMode": null,
      "patches": false,
      "target": 80,
      "quality": 83.2,
      "score": 80.95402645,
      "bytes": 110437,
      "file": "jixel-q83.2-e6-ssimu81.0.jxl"
    },
    {
      "codec": "jixel",
      "effort": 6,
      "depth": 8,
      "yuv": null,
      "hdrMode": null,
      "patches": false,
      "target": 90,
      "quality": 94.9,
      "score": 90.0279078,
      "bytes": 287624,
      "file": "jixel-q94.9-e6-ssimu90.0.jxl"
    },
    {
      "codec": "jixel",
      "effort": 6,
      "depth": 8,
      "yuv": null,
      "hdrMode": null,
      "patches": true,
      "target": 50,
      "quality": 18,
      "score": 51.34447062,
      "bytes": 33474,
      "file": "jixel-q18-e6-patches-ssimu51.3.jxl"
    },
    {
      "codec": "jixel",
      "effort": 6,
      "depth": 8,
      "yuv": null,
      "hdrMode": null,
      "patches": true,
      "target": 60,
      "quality": 48.4,
      "score": 60.35239216,
      "bytes": 42699,
      "file": "jixel-q48.4-e6-patches-ssimu60.4.jxl"
    },
    {
      "codec": "jixel",
      "effort": 6,
      "depth": 8,
      "yuv": null,
      "hdrMode": null,
      "patches": true,
      "target": 70,
      "quality": 70.9,
      "score": 70.17137397,
      "bytes": 62478,
      "file": "jixel-q70.9-e6-patches-ssimu70.2.jxl"
    },
    {
      "codec": "jixel",
      "effort": 6,
      "depth": 8,
      "yuv": null,
      "hdrMode": null,
      "patches": true,
      "target": 80,
      "quality": 83.2,
      "score": 80.95402645,
      "bytes": 110437,
      "file": "jixel-q83.2-e6-patches-ssimu81.0.jxl"
    },
    {
      "codec": "jixel",
      "effort": 6,
      "depth": 8,
      "yuv": null,
      "hdrMode": null,
      "patches": true,
      "target": 90,
      "quality": 94.6,
      "score": 90.00032117,
      "bytes": 276040,
      "file": "jixel-q94.6-e6-patches-ssimu90.0.jxl"
    }
  ]
}

static-build/posts/2026/10/jpeg-xl-vs-avif/index.md

# Lossy - illustration

<figure class="full-figure max-figure">
<script type="component">{
  "module": "shared/demos/2026/jpeg-xl-vs-avif/CodecCompare",
  "props": {
    "ratio": 0.7499,
    "maxWidth": 799,
    "lossless": "asset-url:./images/cat-illustration-targets/lossless.jxl",
    "losslessBytes": "asset-size:./images/cat-illustration-targets/lossless.jxl",
    "initialQuality": 3,
    "initialCodec": "avif",
    "qualities": [
      {
        "target": 50,
        "avif": { "url": "asset-url:./images/cat-illustration-targets/avif-q20-e0-d8-yuv444-ssimu51.5.avif", "bytes": "asset-size:./images/cat-illustration-targets/avif-q20-e0-d8-yuv444-ssimu51.5.avif", "score": "51.5" },
        "jxl": { "url": "asset-url:./images/cat-illustration-targets/jxl-q18.1-e10-ssimu51.0.jxl", "bytes": "asset-size:./images/cat-illustration-targets/jxl-q18.1-e10-ssimu51.0.jxl", "score": "51.0" },
        "jixel": { "url": "asset-url:./images/cat-illustration-targets/jixel-q18-e6-patches-ssimu51.3.jxl", "bytes": "asset-size:./images/cat-illustration-targets/jixel-q18-e6-patches-ssimu51.3.jxl", "score": "51.3" }
      },
      {
        "target": 60,
        "avif": { "url": "asset-url:./images/cat-illustration-targets/avif-q28-e0-d8-yuv444-ssimu60.3.avif", "bytes": "asset-size:./images/cat-illustration-targets/avif-q28-e0-d8-yuv444-ssimu60.3.avif", "score": "60.3" },
        "jxl": { "url": "asset-url:./images/cat-illustration-targets/jxl-q23.3-e10-ssimu60.0.jxl", "bytes": "asset-size:./images/cat-illustration-targets/jxl-q23.3-e10-ssimu60.0.jxl", "score": "60.0" },
        "jixel": { "url": "asset-url:./images/cat-illustration-targets/jixel-q48.4-e6-patches-ssimu60.4.jxl", "bytes": "asset-size:./images/cat-illustration-targets/jixel-q48.4-e6-patches-ssimu60.4.jxl", "score": "60.4" }
      },
      {
        "target": 70,
        "avif": { "url": "asset-url:./images/cat-illustration-targets/avif-q39-e0-d8-yuv444-ssimu71.5.avif", "bytes": "asset-size:./images/cat-illustration-targets/avif-q39-e0-d8-yuv444-ssimu71.5.avif", "score": "71.5" },
        "jxl": { "url": "asset-url:./images/cat-illustration-targets/jxl-q44.9-e10-ssimu70.2.jxl", "bytes": "asset-size:./images/cat-illustration-targets/jxl-q44.9-e10-ssimu70.2.jxl", "score": "70.2" },
        "jixel": { "url": "asset-url:./images/cat-illustration-targets/jixel-q70.9-e6-patches-ssimu70.2.jxl", "bytes": "asset-size:./images/cat-illustration-targets/jixel-q70.9-e6-patches-ssimu70.2.jxl", "score": "70.2" }
      },
      {
        "target": 80,
        "avif": { "url": "asset-url:./images/cat-illustration-targets/avif-q52-e0-d8-yuv444-ssimu80.2.avif", "bytes": "asset-size:./images/cat-illustration-targets/avif-q52-e0-d8-yuv444-ssimu80.2.avif", "score": "80.2" },
        "jxl": { "url": "asset-url:./images/cat-illustration-targets/jxl-q72.1-e10-ssimu80.0.jxl", "bytes": "asset-size:./images/cat-illustration-targets/jxl-q72.1-e10-ssimu80.0.jxl", "score": "80.0" },
        "jixel": { "url": "asset-url:./images/cat-illustration-targets/jixel-q83.2-e6-patches-ssimu81.0.jxl", "bytes": "asset-size:./images/cat-illustration-targets/jixel-q83.2-e6-patches-ssimu81.0.jxl", "score": "81.0" }
      },
      {
        "target": 90,
        "avif": { "url": "asset-url:./images/cat-illustration-targets/avif-q99-e0-d8-yuv444-ssimu86.6.avif", "bytes": "asset-size:./images/cat-illustration-targets/avif-q99-e0-d8-yuv444-ssimu86.6.avif", "score": "86.6" },
        "jxl": { "url": "asset-url:./images/cat-illustration-targets/jxl-q97.4-e10-ssimu90.1.jxl", "bytes": "asset-size:./images/cat-illustration-targets/jxl-q97.4-e10-ssimu90.1.jxl", "score": "90.1" },
        "jixel": { "url": "asset-url:./images/cat-illustration-targets/jixel-q94.6-e6-patches-ssimu90.0.jxl", "bytes": "asset-size:./images/cat-illustration-targets/jixel-q94.6-e6-patches-ssimu90.0.jxl", "score": "90.0" }
      }
    ]
  }
}</script>
</figure>