static-build/posts/2026/10/jxl-on-the-web/images/f1-large-targets/targets.json

{
  "input": "/Users/jarchibald/dev/image-codec-bench/inputs/f1-large.jpg",
  "reference": {
    "path": "/Users/jarchibald/dev/image-codec-bench/out/f1-large-targets/.tmp/reference.png",
    "width": 5301,
    "height": 3423,
    "depth": 8,
    "channels": 3,
    "hasAlpha": false,
    "megapixels": 18.145323,
    "strippedChunks": [],
    "resized": false,
    "source": {
      "width": 5301,
      "height": 3423,
      "hasAlpha": false
    }
  },
  "versions": {
    "avifenc": "1.4.2",
    "avifdec": "1.4.2",
    "cjxl": "0.12.0",
    "djxl": "0.12.0",
    "ssimulacra2": "4dbb9a9c96d74608",
    "cwebp": "1.6.0",
    "dwebp": "1.6.0",
    "magick": "7.1.2",
    "cjixel": "cjixel: jixel 0.4.0 (git b45195a)"
  },
  "results": [
    {
      "codec": "avif",
      "effort": 0,
      "depth": 8,
      "yuv": "444",
      "target": 50,
      "quality": 16,
      "score": 50.42945996,
      "bytes": 73887,
      "file": "avif-q16-e0-d8-yuv444-ssimu50.4.avif"
    },
    {
      "codec": "avif",
      "effort": 0,
      "depth": 8,
      "yuv": "444",
      "target": 60,
      "quality": 26,
      "score": 60.0519149,
      "bytes": 96955,
      "file": "avif-q26-e0-d8-yuv444-ssimu60.1.avif"
    },
    {
      "codec": "avif",
      "effort": 0,
      "depth": 8,
      "yuv": "444",
      "target": 70,
      "quality": 39,
      "score": 70.36917705,
      "bytes": 146682,
      "file": "avif-q39-e0-d8-yuv444-ssimu70.4.avif"
    },
    {
      "codec": "avif",
      "effort": 0,
      "depth": 8,
      "yuv": "444",
      "target": 80,
      "quality": 59,
      "score": 80.3794614,
      "bytes": 304338,
      "file": "avif-q59-e0-d8-yuv444-ssimu80.4.avif"
    },
    {
      "codec": "avif",
      "effort": 0,
      "depth": 8,
      "yuv": "444",
      "target": 90,
      "quality": 90,
      "score": 90.46257716,
      "bytes": 1296213,
      "file": "avif-q90-e0-d8-yuv444-ssimu90.5.avif"
    },
    {
      "codec": "jxl",
      "effort": 10,
      "depth": 8,
      "yuv": null,
      "target": 50,
      "quality": 13.1,
      "score": 50.01605084,
      "bytes": 110426,
      "file": "jxl-q13.1-e10-ssimu50.0.jxl"
    },
    {
      "codec": "jxl",
      "effort": 10,
      "depth": 8,
      "yuv": null,
      "target": 60,
      "quality": 20.9,
      "score": 60.0107132,
      "bytes": 201947,
      "file": "jxl-q20.9-e10-ssimu60.0.jxl"
    },
    {
      "codec": "jxl",
      "effort": 10,
      "depth": 8,
      "yuv": null,
      "target": 70,
      "quality": 41.2,
      "score": 70.01046475,
      "bytes": 257823,
      "file": "jxl-q41.2-e10-ssimu70.0.jxl"
    },
    {
      "codec": "jxl",
      "effort": 10,
      "depth": 8,
      "yuv": null,
      "target": 80,
      "quality": 71.8,
      "score": 80.00574684,
      "bytes": 399476,
      "file": "jxl-q71.8-e10-ssimu80.0.jxl"
    },
    {
      "codec": "jxl",
      "effort": 10,
      "depth": 8,
      "yuv": null,
      "target": 90,
      "quality": 93.3,
      "score": 90.04436016,
      "bytes": 1164439,
      "file": "jxl-q93.3-e10-ssimu90.0.jxl"
    },
    {
      "codec": "jixel",
      "effort": 6,
      "depth": 8,
      "yuv": null,
      "hdrMode": null,
      "patches": false,
      "target": 50,
      "quality": 11.5,
      "score": 50.23882658,
      "bytes": 122480,
      "file": "jixel-q11.5-e6-ssimu50.2.jxl"
    },
    {
      "codec": "jixel",
      "effort": 6,
      "depth": 8,
      "yuv": null,
      "hdrMode": null,
      "patches": false,
      "target": 60,
      "quality": 19.6,
      "score": 60.04150043,
      "bytes": 147196,
      "file": "jixel-q19.6-e6-ssimu60.0.jxl"
    },
    {
      "codec": "jixel",
      "effort": 6,
      "depth": 8,
      "yuv": null,
      "hdrMode": null,
      "patches": false,
      "target": 70,
      "quality": 63.9,
      "score": 70.06666741,
      "bytes": 190087,
      "file": "jixel-q63.9-e6-ssimu70.1.jxl"
    },
    {
      "codec": "jixel",
      "effort": 6,
      "depth": 8,
      "yuv": null,
      "hdrMode": null,
      "patches": false,
      "target": 80,
      "quality": 81.5,
      "score": 80.06422954,
      "bytes": 303361,
      "file": "jixel-q81.5-e6-ssimu80.1.jxl"
    },
    {
      "codec": "jixel",
      "effort": 6,
      "depth": 8,
      "yuv": null,
      "hdrMode": null,
      "patches": false,
      "target": 90,
      "quality": 92.4,
      "score": 90.03913191,
      "bytes": 1014137,
      "file": "jixel-q92.4-e6-ssimu90.0.jxl"
    }
  ]
}

static-build/posts/2026/10/jxl-on-the-web/index.md

# Lossy - F1 image

<figure class="full-figure max-figure">
<script type="component">{
  "module": "shared/demos/2026/jxl-on-the-web/CodecCompare",
  "props": {
    "ratio": 1.5484,
    "maxWidth": 799,
    "lossless": "asset-url:./images/f1-targets/lossless.jxl",
    "losslessBytes": "asset-size:./images/f1-targets/lossless.jxl",
    "initialQuality": 2,
    "initialCodec": "avif",
    "qualities": [
      {
        "target": 50,
        "avif": { "url": "asset-url:./images/f1-targets/avif-q26-e0-d8-yuv444-ssimu51.6.avif", "bytes": "asset-size:./images/f1-targets/avif-q26-e0-d8-yuv444-ssimu51.6.avif", "score": "51.6" },
        "jxl": { "url": "asset-url:./images/f1-targets/jxl-q20.5-e10-ssimu50.4.jxl", "bytes": "asset-size:./images/f1-targets/jxl-q20.5-e10-ssimu50.4.jxl", "score": "50.4" },
        "jixel": { "url": "asset-url:./images/f1-targets/jixel-q16.7-e6-ssimu50.0.jxl", "bytes": "asset-size:./images/f1-targets/jixel-q16.7-e6-ssimu50.0.jxl", "score": "50.0" }
      },
      {
        "target": 60,
        "avif": { "url": "asset-url:./images/f1-targets/avif-q34-e0-d8-yuv444-ssimu60.1.avif", "bytes": "asset-size:./images/f1-targets/avif-q34-e0-d8-yuv444-ssimu60.1.avif", "score": "60.1" },
        "jxl": { "url": "asset-url:./images/f1-targets/jxl-q29.4-e10-ssimu60.1.jxl", "bytes": "asset-size:./images/f1-targets/jxl-q29.4-e10-ssimu60.1.jxl", "score": "60.1" },
        "jixel": { "url": "asset-url:./images/f1-targets/jixel-q52.1-e6-ssimu60.1.jxl", "bytes": "asset-size:./images/f1-targets/jixel-q52.1-e6-ssimu60.1.jxl", "score": "60.1" }
      },
      {
        "target": 70,
        "avif": { "url": "asset-url:./images/f1-targets/avif-q44-e0-d8-yuv444-ssimu70.2.avif", "bytes": "asset-size:./images/f1-targets/avif-q44-e0-d8-yuv444-ssimu70.2.avif", "score": "70.2" },
        "jxl": { "url": "asset-url:./images/f1-targets/jxl-q53-e10-ssimu70.0.jxl", "bytes": "asset-size:./images/f1-targets/jxl-q53-e10-ssimu70.0.jxl", "score": "70.0" },
        "jixel": { "url": "asset-url:./images/f1-targets/jixel-q72.3-e6-ssimu70.3.jxl", "bytes": "asset-size:./images/f1-targets/jixel-q72.3-e6-ssimu70.3.jxl", "score": "70.3" }
      },
      {
        "target": 80,
        "avif": { "url": "asset-url:./images/f1-targets/avif-q58-e0-d8-yuv444-ssimu80.1.avif", "bytes": "asset-size:./images/f1-targets/avif-q58-e0-d8-yuv444-ssimu80.1.avif", "score": "80.1" },
        "jxl": { "url": "asset-url:./images/f1-targets/jxl-q73.5-e10-ssimu80.1.jxl", "bytes": "asset-size:./images/f1-targets/jxl-q73.5-e10-ssimu80.1.jxl", "score": "80.1" },
        "jixel": { "url": "asset-url:./images/f1-targets/jixel-q83.1-e6-ssimu80.7.jxl", "bytes": "asset-size:./images/f1-targets/jixel-q83.1-e6-ssimu80.7.jxl", "score": "80.7" }
      },
      {
        "target": 90,
        "avif": { "url": "asset-url:./images/f1-targets/avif-q86-e0-d8-yuv444-ssimu90.2.avif", "bytes": "asset-size:./images/f1-targets/avif-q86-e0-d8-yuv444-ssimu90.2.avif", "score": "90.2" },
        "jxl": { "url": "asset-url:./images/f1-targets/jxl-q91.4-e10-ssimu90.0.jxl", "bytes": "asset-size:./images/f1-targets/jxl-q91.4-e10-ssimu90.0.jxl", "score": "90.0" },
        "jixel": { "url": "asset-url:./images/f1-targets/jixel-q91.6-e6-ssimu90.0.jxl", "bytes": "asset-size:./images/f1-targets/jixel-q91.6-e6-ssimu90.0.jxl", "score": "90.0" }
      }
    ]
  }
}</script>
</figure>

# Lossy - large

<figure class="full-figure super-breakout">
<script type="component">{
  "module": "shared/demos/2026/jxl-on-the-web/CodecCompare",
  "props": {
    "ratio": 1.5486,
    "maxWidth": 2650,
    "lossless": "asset-url:./images/f1-large-targets/original.jpg",
    "losslessBytes": "asset-size:./images/f1-large-targets/original.jpg",
    "losslessLabel": "Original",
    "initialQuality": 2,
    "initialCodec": "avif",
    "qualities": [
      {
        "target": 50,
        "avif": { "url": "asset-url:./images/f1-large-targets/avif-q16-e0-d8-yuv444-ssimu50.4.avif", "bytes": "asset-size:./images/f1-large-targets/avif-q16-e0-d8-yuv444-ssimu50.4.avif", "score": "50.4" },
        "jxl": { "url": "asset-url:./images/f1-large-targets/jxl-q13.1-e10-ssimu50.0.jxl", "bytes": "asset-size:./images/f1-large-targets/jxl-q13.1-e10-ssimu50.0.jxl", "score": "50.0" },
        "jixel": { "url": "asset-url:./images/f1-large-targets/jixel-q11.5-e6-ssimu50.2.jxl", "bytes": "asset-size:./images/f1-large-targets/jixel-q11.5-e6-ssimu50.2.jxl", "score": "50.2" }
      },
      {
        "target": 60,
        "avif": { "url": "asset-url:./images/f1-large-targets/avif-q26-e0-d8-yuv444-ssimu60.1.avif", "bytes": "asset-size:./images/f1-large-targets/avif-q26-e0-d8-yuv444-ssimu60.1.avif", "score": "60.1" },
        "jxl": { "url": "asset-url:./images/f1-large-targets/jxl-q20.9-e10-ssimu60.0.jxl", "bytes": "asset-size:./images/f1-large-targets/jxl-q20.9-e10-ssimu60.0.jxl", "score": "60.0" },
        "jixel": { "url": "asset-url:./images/f1-large-targets/jixel-q19.6-e6-ssimu60.0.jxl", "bytes": "asset-size:./images/f1-large-targets/jixel-q19.6-e6-ssimu60.0.jxl", "score": "60.0" }
      },
      {
        "target": 70,
        "avif": { "url": "asset-url:./images/f1-large-targets/avif-q39-e0-d8-yuv444-ssimu70.4.avif", "bytes": "asset-size:./images/f1-large-targets/avif-q39-e0-d8-yuv444-ssimu70.4.avif", "score": "70.4" },
        "jxl": { "url": "asset-url:./images/f1-large-targets/jxl-q41.2-e10-ssimu70.0.jxl", "bytes": "asset-size:./images/f1-large-targets/jxl-q41.2-e10-ssimu70.0.jxl", "score": "70.0" },
        "jixel": { "url": "asset-url:./images/f1-large-targets/jixel-q63.9-e6-ssimu70.1.jxl", "bytes": "asset-size:./images/f1-large-targets/jixel-q63.9-e6-ssimu70.1.jxl", "score": "70.1" }
      },
      {
        "target": 80,
        "avif": { "url": "asset-url:./images/f1-large-targets/avif-q59-e0-d8-yuv444-ssimu80.4.avif", "bytes": "asset-size:./images/f1-large-targets/avif-q59-e0-d8-yuv444-ssimu80.4.avif", "score": "80.4" },
        "jxl": { "url": "asset-url:./images/f1-large-targets/jxl-q71.8-e10-ssimu80.0.jxl", "bytes": "asset-size:./images/f1-large-targets/jxl-q71.8-e10-ssimu80.0.jxl", "score": "80.0" },
        "jixel": { "url": "asset-url:./images/f1-large-targets/jixel-q81.5-e6-ssimu80.1.jxl", "bytes": "asset-size:./images/f1-large-targets/jixel-q81.5-e6-ssimu80.1.jxl", "score": "80.1" }
      },
      {
        "target": 90,
        "avif": { "url": "asset-url:./images/f1-large-targets/avif-q90-e0-d8-yuv444-ssimu90.5.avif", "bytes": "asset-size:./images/f1-large-targets/avif-q90-e0-d8-yuv444-ssimu90.5.avif", "score": "90.5" },
        "jxl": { "url": "asset-url:./images/f1-large-targets/jxl-q93.3-e10-ssimu90.0.jxl", "bytes": "asset-size:./images/f1-large-targets/jxl-q93.3-e10-ssimu90.0.jxl", "score": "90.0" },
        "jixel": { "url": "asset-url:./images/f1-large-targets/jixel-q92.4-e6-ssimu90.0.jxl", "bytes": "asset-size:./images/f1-large-targets/jixel-q92.4-e6-ssimu90.0.jxl", "score": "90.0" }
      }
    ]
  }
}</script>
</figure>

# Progressive

The preview frame I chose for the AVIF is enough to tell it's an open-wheel race car. If you know F1, you'll know what team it is. You might even know where the photo was taken. And it delivers that in ~11.5 kB.