static-build/posts/2026/10/jxl-on-the-web/images/f1-targets/targets.json

{
  "input": "/Users/jarchibald/dev/image-codec-bench/inputs/f1.png",
  "reference": {
    "path": "/Users/jarchibald/dev/image-codec-bench/out/f1-targets/.tmp/reference.png",
    "width": 1598,
    "height": 1032,
    "depth": 8,
    "channels": 3,
    "hasAlpha": false,
    "megapixels": 1.649136,
    "strippedChunks": [],
    "resized": false,
    "source": {
      "width": 1598,
      "height": 1032,
      "hasAlpha": false
    }
  },
  "versions": {
    "avifenc": "1.4.2",
    "avifdec": "1.4.2",
    "cjxl": "0.12.0",
    "djxl": "0.12.0",
    "ssimulacra2": "4dbb9a9c96d74608",
    "cwebp": "1.6.0",
    "dwebp": "1.6.0",
    "magick": "7.1.2",
    "cjixel": "cjixel: jixel 0.4.0 (git b45195a)"
  },
  "results": [
    {
      "codec": "avif",
      "effort": 0,
      "depth": 8,
      "yuv": "444",
      "target": 50,
      "quality": 26,
      "score": 51.57696843,
      "bytes": 23748,
      "file": "avif-q26-e0-d8-yuv444-ssimu51.6.avif"
    },
    {
      "codec": "avif",
      "effort": 0,
      "depth": 8,
      "yuv": "444",
      "target": 60,
      "quality": 34,
      "score": 60.09776122,
      "bytes": 29861,
      "file": "avif-q34-e0-d8-yuv444-ssimu60.1.avif"
    },
    {
      "codec": "avif",
      "effort": 0,
      "depth": 8,
      "yuv": "444",
      "target": 70,
      "quality": 44,
      "score": 70.15018908,
      "bytes": 41431,
      "file": "avif-q44-e0-d8-yuv444-ssimu70.2.avif"
    },
    {
      "codec": "avif",
      "effort": 0,
      "depth": 8,
      "yuv": "444",
      "target": 80,
      "quality": 58,
      "score": 80.11335983,
      "bytes": 65948,
      "file": "avif-q58-e0-d8-yuv444-ssimu80.1.avif"
    },
    {
      "codec": "avif",
      "effort": 0,
      "depth": 8,
      "yuv": "444",
      "target": 90,
      "quality": 86,
      "score": 90.22087269,
      "bytes": 146669,
      "file": "avif-q86-e0-d8-yuv444-ssimu90.2.avif"
    },
    {
      "codec": "jxl",
      "effort": 10,
      "depth": 8,
      "yuv": null,
      "target": 50,
      "quality": 20.5,
      "score": 50.35980637,
      "bytes": 35564,
      "file": "jxl-q20.5-e10-ssimu50.4.jxl"
    },
    {
      "codec": "jxl",
      "effort": 10,
      "depth": 8,
      "yuv": null,
      "target": 60,
      "quality": 29.4,
      "score": 60.08909708,
      "bytes": 43480,
      "file": "jxl-q29.4-e10-ssimu60.1.jxl"
    },
    {
      "codec": "jxl",
      "effort": 10,
      "depth": 8,
      "yuv": null,
      "target": 70,
      "quality": 53,
      "score": 70.03033685,
      "bytes": 58424,
      "file": "jxl-q53-e10-ssimu70.0.jxl"
    },
    {
      "codec": "jxl",
      "effort": 10,
      "depth": 8,
      "yuv": null,
      "target": 80,
      "quality": 73.5,
      "score": 80.05954595,
      "bytes": 84819,
      "file": "jxl-q73.5-e10-ssimu80.1.jxl"
    },
    {
      "codec": "jxl",
      "effort": 10,
      "depth": 8,
      "yuv": null,
      "target": 90,
      "quality": 91.4,
      "score": 90.03694108,
      "bytes": 165813,
      "file": "jxl-q91.4-e10-ssimu90.0.jxl"
    },
    {
      "codec": "jixel",
      "effort": 6,
      "depth": 8,
      "yuv": null,
      "hdrMode": null,
      "patches": false,
      "target": 50,
      "quality": 16.7,
      "score": 50.01097026,
      "bytes": 27458,
      "file": "jixel-q16.7-e6-ssimu50.0.jxl"
    },
    {
      "codec": "jixel",
      "effort": 6,
      "depth": 8,
      "yuv": null,
      "hdrMode": null,
      "patches": false,
      "target": 60,
      "quality": 52.1,
      "score": 60.07046505,
      "bytes": 34300,
      "file": "jixel-q52.1-e6-ssimu60.1.jxl"
    },
    {
      "codec": "jixel",
      "effort": 6,
      "depth": 8,
      "yuv": null,
      "hdrMode": null,
      "patches": false,
      "target": 70,
      "quality": 72.3,
      "score": 70.25784413,
      "bytes": 47513,
      "file": "jixel-q72.3-e6-ssimu70.3.jxl"
    },
    {
      "codec": "jixel",
      "effort": 6,
      "depth": 8,
      "yuv": null,
      "hdrMode": null,
      "patches": false,
      "target": 80,
      "quality": 83.1,
      "score": 80.6594481,
      "bytes": 75073,
      "file": "jixel-q83.1-e6-ssimu80.7.jxl"
    },
    {
      "codec": "jixel",
      "effort": 6,
      "depth": 8,
      "yuv": null,
      "hdrMode": null,
      "patches": false,
      "target": 90,
      "quality": 91.6,
      "score": 90.03524526,
      "bytes": 147284,
      "file": "jixel-q91.6-e6-ssimu90.0.jxl"
    }
  ]
}

static-build/posts/2026/10/jxl-on-the-web/index.md

# Lossy - F1 image

<figure class="full-figure max-figure">
<script type="component">{
  "module": "shared/demos/2026/jxl-on-the-web/CodecCompare",
  "props": {
    "ratio": 1.5484,
    "maxWidth": 799,
    "lossless": "asset-url:./images/f1-targets/lossless.jxl",
    "losslessBytes": "asset-size:./images/f1-targets/lossless.jxl",
    "initialQuality": 2,
    "initialCodec": "avif",
    "qualities": [
      {
        "target": 50,
        "avif": { "url": "asset-url:./images/f1-targets/avif-q26-e0-d8-yuv444-ssimu51.6.avif", "bytes": "asset-size:./images/f1-targets/avif-q26-e0-d8-yuv444-ssimu51.6.avif", "score": "51.6" },
        "jxl": { "url": "asset-url:./images/f1-targets/jxl-q20.5-e10-ssimu50.4.jxl", "bytes": "asset-size:./images/f1-targets/jxl-q20.5-e10-ssimu50.4.jxl", "score": "50.4" },
        "jixel": { "url": "asset-url:./images/f1-targets/jixel-q16.7-e6-ssimu50.0.jxl", "bytes": "asset-size:./images/f1-targets/jixel-q16.7-e6-ssimu50.0.jxl", "score": "50.0" }
      },
      {
        "target": 60,
        "avif": { "url": "asset-url:./images/f1-targets/avif-q34-e0-d8-yuv444-ssimu60.1.avif", "bytes": "asset-size:./images/f1-targets/avif-q34-e0-d8-yuv444-ssimu60.1.avif", "score": "60.1" },
        "jxl": { "url": "asset-url:./images/f1-targets/jxl-q29.4-e10-ssimu60.1.jxl", "bytes": "asset-size:./images/f1-targets/jxl-q29.4-e10-ssimu60.1.jxl", "score": "60.1" },
        "jixel": { "url": "asset-url:./images/f1-targets/jixel-q52.1-e6-ssimu60.1.jxl", "bytes": "asset-size:./images/f1-targets/jixel-q52.1-e6-ssimu60.1.jxl", "score": "60.1" }
      },
      {
        "target": 70,
        "avif": { "url": "asset-url:./images/f1-targets/avif-q44-e0-d8-yuv444-ssimu70.2.avif", "bytes": "asset-size:./images/f1-targets/avif-q44-e0-d8-yuv444-ssimu70.2.avif", "score": "70.2" },
        "jxl": { "url": "asset-url:./images/f1-targets/jxl-q53-e10-ssimu70.0.jxl", "bytes": "asset-size:./images/f1-targets/jxl-q53-e10-ssimu70.0.jxl", "score": "70.0" },
        "jixel": { "url": "asset-url:./images/f1-targets/jixel-q72.3-e6-ssimu70.3.jxl", "bytes": "asset-size:./images/f1-targets/jixel-q72.3-e6-ssimu70.3.jxl", "score": "70.3" }
      },
      {
        "target": 80,
        "avif": { "url": "asset-url:./images/f1-targets/avif-q58-e0-d8-yuv444-ssimu80.1.avif", "bytes": "asset-size:./images/f1-targets/avif-q58-e0-d8-yuv444-ssimu80.1.avif", "score": "80.1" },
        "jxl": { "url": "asset-url:./images/f1-targets/jxl-q73.5-e10-ssimu80.1.jxl", "bytes": "asset-size:./images/f1-targets/jxl-q73.5-e10-ssimu80.1.jxl", "score": "80.1" },
        "jixel": { "url": "asset-url:./images/f1-targets/jixel-q83.1-e6-ssimu80.7.jxl", "bytes": "asset-size:./images/f1-targets/jixel-q83.1-e6-ssimu80.7.jxl", "score": "80.7" }
      },
      {
        "target": 90,
        "avif": { "url": "asset-url:./images/f1-targets/avif-q86-e0-d8-yuv444-ssimu90.2.avif", "bytes": "asset-size:./images/f1-targets/avif-q86-e0-d8-yuv444-ssimu90.2.avif", "score": "90.2" },
        "jxl": { "url": "asset-url:./images/f1-targets/jxl-q91.4-e10-ssimu90.0.jxl", "bytes": "asset-size:./images/f1-targets/jxl-q91.4-e10-ssimu90.0.jxl", "score": "90.0" },
        "jixel": { "url": "asset-url:./images/f1-targets/jixel-q91.6-e6-ssimu90.0.jxl", "bytes": "asset-size:./images/f1-targets/jixel-q91.6-e6-ssimu90.0.jxl", "score": "90.0" }
      }
    ]
  }
}</script>
</figure>

# Lossy - red panda

<figure class="full-figure max-figure">
<script type="component">{
  "module": "shared/demos/2026/jxl-on-the-web/CodecCompare",
  "props": {
    "ratio": 1.4935,
    "maxWidth": 799,
    "lossless": "asset-url:./images/red-panda-targets/lossless.jxl",
    "losslessBytes": "asset-size:./images/red-panda-targets/lossless.jxl",
    "initialQuality": 2,
    "initialCodec": "avif",
    "qualities": [
      {
        "target": 50,
        "avif": { "url": "asset-url:./images/red-panda-targets/avif-q37-e0-d8-yuv444-ssimu51.6.avif", "bytes": "asset-size:./images/red-panda-targets/avif-q37-e0-d8-yuv444-ssimu51.6.avif", "score": "51.6" },
        "jxl": { "url": "asset-url:./images/red-panda-targets/jxl-q40.9-e10-ssimu50.2.jxl", "bytes": "asset-size:./images/red-panda-targets/jxl-q40.9-e10-ssimu50.2.jxl", "score": "50.2" },
        "jixel": { "url": "asset-url:./images/red-panda-targets/jixel-q49.9-e6-ssimu50.1.jxl", "bytes": "asset-size:./images/red-panda-targets/jixel-q49.9-e6-ssimu50.1.jxl", "score": "50.1" }
      },
      {
        "target": 60,
        "avif": { "url": "asset-url:./images/red-panda-targets/avif-q44-e0-d8-yuv444-ssimu60.6.avif", "bytes": "asset-size:./images/red-panda-targets/avif-q44-e0-d8-yuv444-ssimu60.6.avif", "score": "60.6" },
        "jxl": { "url": "asset-url:./images/red-panda-targets/jxl-q58.7-e10-ssimu60.0.jxl", "bytes": "asset-size:./images/red-panda-targets/jxl-q58.7-e10-ssimu60.0.jxl", "score": "60.0" },
        "jixel": { "url": "asset-url:./images/red-panda-targets/jixel-q68.7-e6-ssimu60.1.jxl", "bytes": "asset-size:./images/red-panda-targets/jixel-q68.7-e6-ssimu60.1.jxl", "score": "60.1" }
      },
      {
        "target": 70,
        "avif": { "url": "asset-url:./images/red-panda-targets/avif-q52-e0-d8-yuv444-ssimu70.3.avif", "bytes": "asset-size:./images/red-panda-targets/avif-q52-e0-d8-yuv444-ssimu70.3.avif", "score": "70.3" },
        "jxl": { "url": "asset-url:./images/red-panda-targets/jxl-q71.9-e10-ssimu70.0.jxl", "bytes": "asset-size:./images/red-panda-targets/jxl-q71.9-e10-ssimu70.0.jxl", "score": "70.0" },
        "jixel": { "url": "asset-url:./images/red-panda-targets/jixel-q78.9-e6-ssimu71.2.jxl", "bytes": "asset-size:./images/red-panda-targets/jixel-q78.9-e6-ssimu71.2.jxl", "score": "71.2" }
      },
      {
        "target": 80,
        "avif": { "url": "asset-url:./images/red-panda-targets/avif-q67-e0-d8-yuv444-ssimu80.7.avif", "bytes": "asset-size:./images/red-panda-targets/avif-q67-e0-d8-yuv444-ssimu80.7.avif", "score": "80.7" },
        "jxl": { "url": "asset-url:./images/red-panda-targets/jxl-q84.5-e10-ssimu80.1.jxl", "bytes": "asset-size:./images/red-panda-targets/jxl-q84.5-e10-ssimu80.1.jxl", "score": "80.1" },
        "jixel": { "url": "asset-url:./images/red-panda-targets/jixel-q86.3-e6-ssimu80.2.jxl", "bytes": "asset-size:./images/red-panda-targets/jixel-q86.3-e6-ssimu80.2.jxl", "score": "80.2" }
      },
      {
        "target": 90,
        "avif": { "url": "asset-url:./images/red-panda-targets/avif-q90-e0-d8-yuv444-ssimu90.3.avif", "bytes": "asset-size:./images/red-panda-targets/avif-q90-e0-d8-yuv444-ssimu90.3.avif", "score": "90.3" },
        "jxl": { "url": "asset-url:./images/red-panda-targets/jxl-q95.6-e10-ssimu90.2.jxl", "bytes": "asset-size:./images/red-panda-targets/jxl-q95.6-e10-ssimu90.2.jxl", "score": "90.2" },
        "jixel": { "url": "asset-url:./images/red-panda-targets/jixel-q93.8-e6-ssimu90.0.jxl", "bytes": "asset-size:./images/red-panda-targets/jixel-q93.8-e6-ssimu90.0.jxl", "score": "90.0" }
      }
    ]
  }
}</script>
</figure>